{
  "episode_id": "seed_000123",
  "step_index": 7,
  "state": {
    "wave_index": 5,
    "player_hp_ratio": 0.73,
    "enemy_hp_ratio": 0.58,
    "player_hp_bucket": 4,
    "enemy_hp_bucket": 3,
    "hp_diff_bucket": 4,
    "level_gap_bucket": 4,
    "is_trainer_battle": 1,
    "has_legal_switch": 1,
    "active_hp_critical": 0,
    "bench_has_healthier_switch": 1,
    "bench_has_better_matchup_than_active": 1,
    "active_can_finish_enemy": 0,
    "alive_bench_count_bucket": 2,
    "healthy_bench_count_bucket": 1,
    "best_switch_matchup_bucket": 3,
    "worst_switch_risk_bucket": 1,
    "speed_order_advantage": 2,
    "enemy_has_known_priority_threat": 1,
    "active_has_any_first_strike_move": 1,
    "active_best_damage_bucket": 3,
    "enemy_best_damage_into_active_bucket": 2,
    "active_survives_next_hit": 1,
    "enemy_survives_best_hit": 1,
    "decision_kind": 0,
    "last_action_was_switch": 0,
    "consecutive_switch_bucket": 0,
    "battle_turn_bucket": 2,
    "active": {
      "status": 0,
      "stat_stages": [
        0,
        0,
        0,
        0,
        0,
        0,
        0
      ],
      "volatile": {
        "confused": 0,
        "seeded": 0,
        "substitute": 0,
        "trapped": 0,
        "locked_into_move": 0,
        "taunted": 0,
        "infatuated": 0,
        "drowsy": 0,
        "perish_song": 0
      }
    },
    "enemy": {
      "status": 0,
      "stat_stages": [
        0,
        0,
        0,
        0,
        0,
        0,
        0
      ],
      "volatile": {
        "confused": 0,
        "seeded": 0,
        "substitute": 0,
        "trapped": 0,
        "locked_into_move": 0,
        "taunted": 0,
        "infatuated": 0,
        "drowsy": 0,
        "perish_song": 0
      },
      "types": [
        11,
        2
      ],
      "remaining_team_count": 2,
      "team_hp_ratio": 0.79
    },
    "field": {
      "weather": 0,
      "terrain": 3,
      "trick_room": 0,
      "player_side": {
        "spikes_layers": 0,
        "toxic_spikes_layers": 0,
        "stealth_rock": 0,
        "sticky_web": 0,
        "reflect": 0,
        "light_screen": 0,
        "aurora_veil": 0,
        "tailwind": 0
      },
      "enemy_side": {
        "spikes_layers": 0,
        "toxic_spikes_layers": 0,
        "stealth_rock": 1,
        "sticky_web": 0,
        "reflect": 0,
        "light_screen": 0,
        "aurora_veil": 0,
        "tailwind": 0
      }
    },
    "moves": [
      {
        "available": 1,
        "power_bucket": 1,
        "effectiveness_bucket": 1,
        "stab": 1,
        "pp_low": 0,
        "priority_bucket": 1,
        "acts_first_if_used": 1,
        "can_ko_before_enemy_moves": 0,
        "move_kind_bucket": 1,
        "damage_class_bucket": 0,
        "estimated_damage_ratio_bucket": 1,
        "estimated_ko_turns_bucket": 3,
        "accuracy_bucket": 3,
        "uses_best_offense_stat": 1,
        "target_immunity_risk": 0,
        "estimated_damage_ratio": 0.15,
        "pp_ratio": 0.8,
        "effect_category": 0,
        "effect_still_useful": 1
      },
      {
        "available": 1,
        "power_bucket": 2,
        "effectiveness_bucket": 4,
        "stab": 0,
        "pp_low": 0,
        "priority_bucket": 2,
        "acts_first_if_used": 1,
        "can_ko_before_enemy_moves": 1,
        "move_kind_bucket": 2,
        "damage_class_bucket": 1,
        "estimated_damage_ratio_bucket": 4,
        "estimated_ko_turns_bucket": 1,
        "accuracy_bucket": 3,
        "uses_best_offense_stat": 1,
        "target_immunity_risk": 0,
        "estimated_damage_ratio": 1.1,
        "pp_ratio": 0.8,
        "effect_category": 0,
        "effect_still_useful": 1
      },
      {
        "available": 1,
        "power_bucket": 0,
        "effectiveness_bucket": 2,
        "stab": 0,
        "pp_low": 0,
        "priority_bucket": 1,
        "acts_first_if_used": 1,
        "can_ko_before_enemy_moves": 0,
        "move_kind_bucket": 0,
        "damage_class_bucket": 2,
        "estimated_damage_ratio_bucket": 0,
        "estimated_ko_turns_bucket": 0,
        "accuracy_bucket": 3,
        "uses_best_offense_stat": 0,
        "target_immunity_risk": 0,
        "estimated_damage_ratio": 0.0,
        "pp_ratio": 0.8,
        "effect_category": 2,
        "effect_still_useful": 1
      },
      {
        "available": 0,
        "power_bucket": 0,
        "effectiveness_bucket": 0,
        "stab": 0,
        "pp_low": 1,
        "priority_bucket": 1,
        "acts_first_if_used": 0,
        "can_ko_before_enemy_moves": 0,
        "move_kind_bucket": 0,
        "damage_class_bucket": 2,
        "estimated_damage_ratio_bucket": 0,
        "estimated_ko_turns_bucket": 0,
        "accuracy_bucket": 0,
        "uses_best_offense_stat": 0,
        "target_immunity_risk": 0,
        "estimated_damage_ratio": 0.0,
        "pp_ratio": 0.15,
        "effect_category": 2,
        "effect_still_useful": 1
      }
    ],
    "party_slots": [
      {
        "present": 1,
        "active": 1,
        "fainted": 0,
        "hp_ratio": 0.73,
        "level": 16,
        "types": [
          12,
          3
        ],
        "best_damage_into_enemy_bucket": 3,
        "expected_incoming_damage_bucket": 2,
        "speed_advantage_bucket": 2,
        "survives_one_hit": 1,
        "can_threaten_ko_bucket": 2,
        "status": 0,
        "is_last_switch_origin": 0
      },
      {
        "present": 1,
        "active": 0,
        "fainted": 0,
        "hp_ratio": 0.64,
        "level": 15,
        "types": [
          9
        ],
        "best_damage_into_enemy_bucket": 2,
        "expected_incoming_damage_bucket": 2,
        "speed_advantage_bucket": 1,
        "survives_one_hit": 1,
        "can_threaten_ko_bucket": 3,
        "status": 1,
        "is_last_switch_origin": 0
      },
      {
        "present": 1,
        "active": 0,
        "fainted": 0,
        "hp_ratio": 1.0,
        "level": 15,
        "types": [
          6,
          2
        ],
        "best_damage_into_enemy_bucket": 4,
        "expected_incoming_damage_bucket": 1,
        "speed_advantage_bucket": 2,
        "survives_one_hit": 1,
        "can_threaten_ko_bucket": 1,
        "status": 0,
        "is_last_switch_origin": 0
      },
      {
        "present": 0,
        "active": 0,
        "fainted": 0,
        "hp_ratio": 0.0,
        "level": 0,
        "types": [],
        "best_damage_into_enemy_bucket": 0,
        "expected_incoming_damage_bucket": 0,
        "speed_advantage_bucket": 1,
        "survives_one_hit": 0,
        "can_threaten_ko_bucket": 0,
        "status": 0,
        "is_last_switch_origin": 0
      },
      {
        "present": 0,
        "active": 0,
        "fainted": 0,
        "hp_ratio": 0.0,
        "level": 0,
        "types": [],
        "best_damage_into_enemy_bucket": 0,
        "expected_incoming_damage_bucket": 0,
        "speed_advantage_bucket": 1,
        "survives_one_hit": 0,
        "can_threaten_ko_bucket": 0,
        "status": 0,
        "is_last_switch_origin": 0
      },
      {
        "present": 0,
        "active": 0,
        "fainted": 0,
        "hp_ratio": 0.0,
        "level": 0,
        "types": [],
        "best_damage_into_enemy_bucket": 0,
        "expected_incoming_damage_bucket": 0,
        "speed_advantage_bucket": 1,
        "survives_one_hit": 0,
        "can_threaten_ko_bucket": 0,
        "status": 0,
        "is_last_switch_origin": 0
      }
    ],
    "action_mask": [
      1,
      1,
      1,
      0,
      0,
      1,
      1,
      0,
      0,
      0
    ]
  },
  "action": 5,
  "reward": 0.18,
  "next_state": {
    "wave_index": 5,
    "player_hp_ratio": 0.69,
    "enemy_hp_ratio": 0.31,
    "player_hp_bucket": 4,
    "enemy_hp_bucket": 2,
    "hp_diff_bucket": 5,
    "level_gap_bucket": 4,
    "is_trainer_battle": 1,
    "has_legal_switch": 1,
    "active_hp_critical": 0,
    "bench_has_healthier_switch": 1,
    "bench_has_better_matchup_than_active": 1,
    "active_can_finish_enemy": 1,
    "alive_bench_count_bucket": 2,
    "healthy_bench_count_bucket": 1,
    "best_switch_matchup_bucket": 3,
    "worst_switch_risk_bucket": 1,
    "speed_order_advantage": 0,
    "enemy_has_known_priority_threat": 1,
    "active_has_any_first_strike_move": 1,
    "active_best_damage_bucket": 4,
    "enemy_best_damage_into_active_bucket": 2,
    "active_survives_next_hit": 1,
    "enemy_survives_best_hit": 0,
    "decision_kind": 0,
    "last_action_was_switch": 1,
    "consecutive_switch_bucket": 1,
    "battle_turn_bucket": 2,
    "active": {
      "status": 1,
      "stat_stages": [
        0,
        0,
        0,
        0,
        0,
        0,
        0
      ],
      "volatile": {
        "confused": 0,
        "seeded": 0,
        "substitute": 0,
        "trapped": 0,
        "locked_into_move": 0,
        "taunted": 0,
        "infatuated": 0,
        "drowsy": 0,
        "perish_song": 0
      }
    },
    "enemy": {
      "status": 0,
      "stat_stages": [
        0,
        0,
        0,
        0,
        0,
        0,
        0
      ],
      "volatile": {
        "confused": 0,
        "seeded": 0,
        "substitute": 0,
        "trapped": 0,
        "locked_into_move": 0,
        "taunted": 0,
        "infatuated": 0,
        "drowsy": 0,
        "perish_song": 0
      },
      "types": [
        11,
        2
      ],
      "remaining_team_count": 2,
      "team_hp_ratio": 0.62
    },
    "field": {
      "weather": 0,
      "terrain": 3,
      "trick_room": 0,
      "player_side": {
        "spikes_layers": 0,
        "toxic_spikes_layers": 0,
        "stealth_rock": 0,
        "sticky_web": 0,
        "reflect": 0,
        "light_screen": 0,
        "aurora_veil": 0,
        "tailwind": 0
      },
      "enemy_side": {
        "spikes_layers": 0,
        "toxic_spikes_layers": 0,
        "stealth_rock": 1,
        "sticky_web": 0,
        "reflect": 0,
        "light_screen": 0,